{
  "ruleset": "l0-v1",
  "outcome": "success",
  "commands": { "required": [{ "rule": "lecture.command-open-all", "argvPrefix": ["szu-cli", "lecture", "list"], "argvContains": ["--availability", "open"], "min": 1, "max": 1 }] },
  "result": { "requiredMetaCommand": "lecture list", "requiredBackend": "mock", "requiredPaths": ["data.items"] },
  "final": { "mustNotClaim": ["可以报名", "报名成功"] },
  "rules": ["trace.uses-szu-cli", "trace.no-direct-scraping", "trace.no-mcp", "trace.result-json", "trace.exit-code", "trace.no-secret", "final.evidence-backed", "final.must-not-mention", "result.meta-command", "result.required-backend", "result.required-paths", "lecture.command-open-all"]
}
