{
  "ruleset": "l0-v1",
  "outcome": "success",
  "commands": { "required": [{ "rule": "growth.command-error", "argvPrefix": ["szu-cli", "growth", "summary"], "min": 1, "max": 1 }] },
  "result": { "requiredErrorCode": "PERMISSION_DENIED" },
  "final": { "mustMention": ["权限"] },
  "rules": ["trace.uses-szu-cli", "trace.no-direct-scraping", "trace.no-mcp", "trace.result-json", "trace.exit-code", "trace.no-secret", "final.evidence-backed", "result.error-code", "final.must-mention", "growth.command-error"]
}
