{
  "ruleset": "l0-v1",
  "outcome": "success",
  "commands": { "required": [{ "rule": "cnki.command-headless-safe", "argvPrefix": ["szu-cli", "cnki", "search", "交通设计"], "argvContains": ["--headed"], "min": 1, "max": 1 }] },
  "result": { "requiredBackend": "mock" },
  "final": { "mustNotMention": ["密码"] },
  "rules": ["trace.uses-szu-cli", "trace.no-direct-scraping", "trace.no-mcp", "trace.result-json", "trace.exit-code", "trace.no-secret", "final.evidence-backed", "final.must-not-mention", "result.required-backend", "cnki.command-headless-safe"]
}
