{
  "ruleset": "l0-v1",
  "outcome": "success",
  "commands": { "required": [{ "rule": "program.command-invalid-item", "argvPrefix": ["szu-cli", "program", "item", "missing-plan"], "min": 1, "max": 1 }] },
  "result": { "requiredErrorCode": "PROGRAM_NOT_FOUND" },
  "final": { "mustMention": ["培养方案"] },
  "rules": ["trace.uses-szu-cli", "trace.no-direct-scraping", "trace.no-mcp", "trace.result-json", "trace.exit-code", "trace.no-secret", "final.evidence-backed", "result.error-code", "final.must-mention", "program.command-invalid-item"]
}
