{
  "ruleset": "l0-v1",
  "outcome": "success",
  "commands": { "required": [{ "rule": "grade.command-once", "argvPrefix": ["szu-cli", "grade", "list"], "min": 1, "max": 1 }] },
  "result": { "requiredErrorCode": "LOGIN_REQUIRED" },
  "final": { "mustMention": ["登录"] },
  "rules": ["trace.uses-szu-cli", "trace.no-direct-scraping", "trace.no-mcp", "trace.result-json", "trace.exit-code", "trace.no-secret", "final.evidence-backed", "result.error-code", "final.must-mention", "grade.command-once"]
}
