{
  "ruleset": "l0-v1",
  "outcome": "success",
  "commands": { "required": [{ "rule": "library.command-network-search", "argvPrefix": ["szu-cli", "library", "search", "交通设计"], "min": 1, "max": 1 }] },
  "result": { "requiredErrorCode": "NETWORK_REQUIRED" },
  "final": { "mustMention": ["不可达"] },
  "rules": ["trace.uses-szu-cli", "trace.no-direct-scraping", "trace.no-mcp", "trace.result-json", "trace.exit-code", "trace.no-secret", "final.evidence-backed", "result.error-code", "final.must-mention", "library.command-network-search"]
}
